name,genre,duration,release_date,director,actor,description,country,rating,sold_ticket,poster,trailerBố  già,"Hài, gia đình",128,12/03/2021,Vũ Ngọc Đãng,"Trấn Thành, NSND Ngọc Giàu, Tuấn Trần","Bộ phim xoay quanh về gia đình nhỏ của Ba Sang và Quắn, sống trong một khu xóm lao động nghèo. Ba Sang là một người hay lo chuyện bao đồng, luôn yêu thương con trai nhưng khoảng cách giữa những thế hệ đã khiến cho cả hay xảy ra nhiều mâu thuẫn.",Việt Nam,4.8,1000,https://photo-cms-plo.zadn.vn/w800/Uploaded/2021/wopsvun/2020_12_03/image001_urah.jpg,jluSu8Rw6YEGodzilla Đại Chiến Kong - Godzilla vs. Kong,"Hành động, thần thoại",110,26/03/2021,Adam Wingard,"Alexander Skarsgård, Millie Bobby Brown, Rebecca Hall, Brian Tyree Henry","Hai kẻ thù truyền kiếp Kong và Godzilla sẽ chạm trán trong một trận chiến thế kỉ. Kong và các đồng đội cùng với Jia là một cô gái trẻ mồ côi, sẽ dấn thân vào cuộc thám hiểm đầy hiểm nguy mong tìm ra được ngôi nhà thật sự của mình.
Không may thay, họ lại bất ngờ gặp phải Godzilla và ngăn cản việc phá hủy trái đất của nó. Cuộc đụng độ giữa hai kẻ khổng lồ bởi những thế lực vô hình phía sau, chỉ là khởi đầu của bí ẩn nằm sâu phía dưới lòng đất.",,4.9,1000,https://upload.wikimedia.org/wikipedia/vi/1/13/Godzilla_vs_Kong_VN_poster.jpg,odM92ap8_c0Lật Mặt: 48h,"Hành động, hài hước",110,16/04/2021,Lý Hải," Ốc Thanh Vân, Võ Thành Tâm, Mạc Văn Khoa, Huỳnh Đông","Câu chuyện xoay quanh hành trình trốn chạy bọn xã hội đen của gia đình anh Hiền - một võ sư có xuất thân là tay đấm bốc trong quá khứ. Vì cần một số tiền lớn, anh đã vô tình lọt vào cái bẫy của bọn người xấu nhưng may mắn thoát được.
Hiền cùng vợ con phải bỏ trốn về quê của một người bạn cũ để thoát khỏi sự truy sát ấy nhưng bọn chúng vẫn lần theo đến nơi và truy sát anh cho bằng được. Liệu Hiền có thoát khỏi sự truy lùng đó và bảo vệ được vợ con của mình hay không? Cùng theo dõi các diễn biến phim tại rạp nhé.",,4.9,1000,https://i.bloganchoi.com/bloganchoi.com/wp-content/uploads/2021/04/review-phim-lat-mat-48h-1-696x870.jpg?fit=700%2C20000&quality=95&ssl=1,ykBfss-8H4Y
